{
  "schema_version": "analysis.result.v1",
  "analysis_id": "analysis_amazon_B0F1RW5JJC",
  "candidate_id": "amazon_B0F1RW5JJC",
  "market": "US",
  "layer_results": {
    "L1": {
      "passed": true,
      "score": 55.5,
      "grade": "A",
      "gate_reason": "PScore 33.3/60.0（55.5%）-> A",
      "required_next_data": []
    },
    "L2": {
      "passed": true,
      "score": 55.5,
      "grade": "A",
      "gate_reason": "评价标签聚类：0 个负面聚类 / 0 次标签提及",
      "required_next_data": []
    },
    "L3": {
      "passed": true,
      "score": 55.5,
      "grade": "A",
      "gate_reason": "同风格信号：frontend_amazon 语料中有 397 款标题命中相同风格词 ['dress', 'dresses', 't-shirt']；带站内畅销榜标记，优先在原平台（Shein）巩固，再评估多平台",
      "required_next_data": [
        "供应链字段人工调查（选品后画像存库用，不参与打分）"
      ]
    }
  },
  "priority_score": {
    "total": 33.3,
    "achievable_max": 60.0,
    "pct": 55.5,
    "grade": "A",
    "components": [
      {
        "name": "市场需求",
        "score": 22.8,
        "max_score": 30.0,
        "reason": "量级信号 sales_30d_units=32,560 -> 12分；销量/销售额增长率 +91.6% -> 6分；1个独立需求证据源",
        "evidence_refs": [
          "ev_593d59279b3588c6",
          "ev_cd2639b9cfe081bd"
        ],
        "missing": false
      },
      {
        "name": "竞争可突破",
        "score": 6.8,
        "max_score": 15.0,
        "reason": "竞品评论门槛≈5,059（组内评论数p90代理）-> 3分；价格带位置 within_p25_p75 -> 6分",
        "evidence_refs": [
          "ev_1d600f213c043d07",
          "ev_280cd7e2f90175e1"
        ],
        "missing": false
      },
      {
        "name": "产品机会",
        "score": 9.0,
        "max_score": 15.0,
        "reason": "评分4.3（低于类目P25_有明确改良空间）-> 8分；有趋势标签/设计细节记录",
        "evidence_refs": [
          "ev_542f49557913c5ba",
          "ev_9b6700eb7e786065"
        ],
        "missing": false
      },
      {
        "name": "风险",
        "score": -5.3,
        "max_score": 0.0,
        "reason": "单一数据源，量价未经第二源互验：仅 seller_sprite_amazon 单源；店铺名含商品品牌词，疑似品牌自营，仿款侵权风险待人工确认：店铺「RUMIA FASHION」品牌词出现在标题中（赛道风险系数×1.33）",
        "evidence_refs": [
          "ev_127bdd8a815f9266",
          "ev_53c4094e0cb09722"
        ],
        "missing": false
      }
    ],
    "track": "trend_rising",
    "track_label": "趋势上升款"
  },
  "track_tags": [
    "趋势上升款",
    "痛点改良款"
  ],
  "recommendation": {
    "decision": "research_more",
    "reason_summary": "市场需求：量级信号 sales_30d_units=32,560 -> 12分；销量/销售额增长率 +91.6% -> 6分；1个独立需求证据源；竞争可突破：竞品评论门槛≈5,059（组内评论数p90代理）-> 3分；价格带位置 within_p25_p75 -> 6分；产品机会：评分4.3（低于类目P25_有明确改良空间）-> 8分；有趋势标签/设计细节记录",
    "risk_summary": "单一数据源，量价未经第二源互验：仅 seller_sprite_amazon 单源；店铺名含商品品牌词，疑似品牌自营，仿款侵权风险待人工确认：店铺「RUMIA FASHION」品牌词出现在标题中（人工待确认）",
    "next_actions": [
      "补齐关键缺字段后复评",
      "L3 完成，等待供应链输入与人审"
    ]
  },
  "claims": [
    {
      "claim": "市场需求：量级信号 sales_30d_units=32,560 -> 12分；销量/销售额增长率 +91.6% -> 6分；1个独立需求证据源",
      "claim_type": "demand",
      "evidence_refs": [
        "ev_593d59279b3588c6",
        "ev_cd2639b9cfe081bd"
      ],
      "confidence": "medium"
    },
    {
      "claim": "竞争可突破：竞品评论门槛≈5,059（组内评论数p90代理）-> 3分；价格带位置 within_p25_p75 -> 6分",
      "claim_type": "competition",
      "evidence_refs": [
        "ev_1d600f213c043d07",
        "ev_280cd7e2f90175e1"
      ],
      "confidence": "medium"
    },
    {
      "claim": "产品机会：评分4.3（低于类目P25_有明确改良空间）-> 8分；有趋势标签/设计细节记录",
      "claim_type": "product",
      "evidence_refs": [
        "ev_542f49557913c5ba",
        "ev_9b6700eb7e786065"
      ],
      "confidence": "medium"
    },
    {
      "claim": "单一数据源，量价未经第二源互验：仅 seller_sprite_amazon 单源",
      "claim_type": "risk",
      "evidence_refs": [
        "ev_53c4094e0cb09722"
      ],
      "confidence": "medium"
    },
    {
      "claim": "店铺名含商品品牌词，疑似品牌自营，仿款侵权风险待人工确认：店铺「RUMIA FASHION」品牌词出现在标题中（人工待确认）",
      "claim_type": "risk",
      "evidence_refs": [
        "ev_127bdd8a815f9266"
      ],
      "confidence": "low"
    },
    {
      "claim": "同风格红海程度：高（语料内同风格候选 1681 款，词表确定性匹配）",
      "claim_type": "cross_platform",
      "evidence_refs": [
        "ev_53c4094e0cb09722"
      ],
      "confidence": "medium"
    },
    {
      "claim": "平台优先级：amazon（带站内畅销榜标记，优先在原平台（Shein）巩固，再评估多平台）",
      "claim_type": "cross_platform",
      "evidence_refs": [
        "ev_69bbab46ee568d4a"
      ],
      "confidence": "medium"
    }
  ],
  "missing_fields": [
    "owned_supply_inputs.target_cost",
    "owned_supply_inputs.moq",
    "owned_supply_inputs.lead_time_days",
    "competition_metrics.category_top10_shop_ratio"
  ],
  "blocked_reasons": [],
  "confidence": "medium",
  "created_at": "2026-07-10T20:45:43+00:00"
}