{
  "schema_version": "analysis.result.v1",
  "analysis_id": "analysis_amazon_B0D7Q86R4N",
  "candidate_id": "amazon_B0D7Q86R4N",
  "market": "US",
  "layer_results": {
    "L1": {
      "passed": true,
      "score": 54.2,
      "grade": "S",
      "gate_reason": "PScore 32.5/60.0（54.2%）-> S",
      "required_next_data": []
    },
    "L2": {
      "passed": true,
      "score": 54.2,
      "grade": "S",
      "gate_reason": "评价标签聚类：0 个负面聚类 / 0 次标签提及",
      "required_next_data": []
    },
    "L3": {
      "passed": true,
      "score": 54.2,
      "grade": "S",
      "gate_reason": "2 个数据源按商品ID互验（seller_sprite_amazon、frontend_amazon）；同风格信号：frontend_amazon 语料中有 318 款标题命中相同风格词 ['dresses']；带站内畅销榜标记，优先在原平台（Shein）巩固，再评估多平台",
      "required_next_data": [
        "供应链字段人工调查（选品后画像存库用，不参与打分）"
      ]
    }
  },
  "priority_score": {
    "total": 32.5,
    "achievable_max": 60.0,
    "pct": 54.2,
    "grade": "S",
    "components": [
      {
        "name": "市场需求",
        "score": 21.6,
        "max_score": 30.0,
        "reason": "量级信号 sales_30d_units=13,276 -> 9分；销量/销售额增长率 +122.5% -> 6分；2个独立需求证据源",
        "evidence_refs": [
          "ev_4f896cfbca4b2a0a",
          "ev_92bfc56146d01a73"
        ],
        "missing": false
      },
      {
        "name": "竞争可突破",
        "score": 6.8,
        "max_score": 15.0,
        "reason": "竞品评论门槛≈5,059（组内评论数p90代理）-> 3分；价格带位置 within_p25_p75 -> 6分",
        "evidence_refs": [
          "ev_6211f9bff38d668f",
          "ev_8d2920878e7709f0",
          "ev_c94f0c76e9e0a8d6",
          "ev_caddda9f2a0289b9"
        ],
        "missing": false
      },
      {
        "name": "产品机会",
        "score": 6.8,
        "max_score": 15.0,
        "reason": "评分4.4（低于类目中位_有一定改良空间）-> 5分；有趋势标签/设计细节记录",
        "evidence_refs": [
          "ev_7c99a6e95ebb7b01",
          "ev_d743ca21efb35296",
          "ev_e42c1d3b3abfbc78"
        ],
        "missing": false
      },
      {
        "name": "风险",
        "score": -2.7,
        "max_score": 0.0,
        "reason": "店铺名含商品品牌词，疑似品牌自营，仿款侵权风险待人工确认：店铺「elescat」品牌词出现在标题中（赛道风险系数×1.33）",
        "evidence_refs": [
          "ev_3a226fecf2ff7c25"
        ],
        "missing": false
      }
    ],
    "track": "trend_rising",
    "track_label": "趋势上升款"
  },
  "track_tags": [
    "趋势上升款"
  ],
  "recommendation": {
    "decision": "recommend_research",
    "reason_summary": "市场需求：量级信号 sales_30d_units=13,276 -> 9分；销量/销售额增长率 +122.5% -> 6分；2个独立需求证据源；竞争可突破：竞品评论门槛≈5,059（组内评论数p90代理）-> 3分；价格带位置 within_p25_p75 -> 6分；产品机会：评分4.4（低于类目中位_有一定改良空间）-> 5分；有趋势标签/设计细节记录",
    "risk_summary": "店铺名含商品品牌词，疑似品牌自营，仿款侵权风险待人工确认：店铺「elescat」品牌词出现在标题中（人工待确认）",
    "next_actions": [
      "进入立项讨论；补齐供应链输入后人审",
      "L3 完成，等待供应链输入与人审"
    ]
  },
  "claims": [
    {
      "claim": "市场需求：量级信号 sales_30d_units=13,276 -> 9分；销量/销售额增长率 +122.5% -> 6分；2个独立需求证据源",
      "claim_type": "demand",
      "evidence_refs": [
        "ev_4f896cfbca4b2a0a",
        "ev_92bfc56146d01a73"
      ],
      "confidence": "high"
    },
    {
      "claim": "竞争可突破：竞品评论门槛≈5,059（组内评论数p90代理）-> 3分；价格带位置 within_p25_p75 -> 6分",
      "claim_type": "competition",
      "evidence_refs": [
        "ev_6211f9bff38d668f",
        "ev_8d2920878e7709f0",
        "ev_c94f0c76e9e0a8d6",
        "ev_caddda9f2a0289b9"
      ],
      "confidence": "high"
    },
    {
      "claim": "产品机会：评分4.4（低于类目中位_有一定改良空间）-> 5分；有趋势标签/设计细节记录",
      "claim_type": "product",
      "evidence_refs": [
        "ev_7c99a6e95ebb7b01",
        "ev_d743ca21efb35296",
        "ev_e42c1d3b3abfbc78"
      ],
      "confidence": "high"
    },
    {
      "claim": "店铺名含商品品牌词，疑似品牌自营，仿款侵权风险待人工确认：店铺「elescat」品牌词出现在标题中（人工待确认）",
      "claim_type": "risk",
      "evidence_refs": [
        "ev_3a226fecf2ff7c25"
      ],
      "confidence": "low"
    },
    {
      "claim": "多源互验：seller_sprite_amazon、frontend_amazon 按商品ID匹配到同一商品",
      "claim_type": "cross_platform",
      "evidence_refs": [
        "ev_037a2245e1638500",
        "ev_dd49a0374b343cb4"
      ],
      "confidence": "high"
    },
    {
      "claim": "同风格红海程度：高（语料内同风格候选 501 款，词表确定性匹配）",
      "claim_type": "cross_platform",
      "evidence_refs": [
        "ev_037a2245e1638500",
        "ev_dd49a0374b343cb4"
      ],
      "confidence": "medium"
    },
    {
      "claim": "平台优先级：amazon（带站内畅销榜标记，优先在原平台（Shein）巩固，再评估多平台）",
      "claim_type": "cross_platform",
      "evidence_refs": [
        "ev_8ab3767bd0b013cd"
      ],
      "confidence": "medium"
    }
  ],
  "missing_fields": [
    "owned_supply_inputs.target_cost",
    "owned_supply_inputs.moq",
    "owned_supply_inputs.lead_time_days",
    "competition_metrics.category_top10_shop_ratio"
  ],
  "blocked_reasons": [],
  "confidence": "high",
  "created_at": "2026-07-10T20:45:43+00:00"
}